time,tweets,role
8/14/2018 7:06," “They were all in on it, clear Hillary Clinton and FRAME Donald Trump for things he didn’t do.” Gregg Jarrett on @foxandfriends If we had a real Attorney General, this Witch Hunt would never have been sta",president
8/14/2018 6:55," Bruce Ohr of the “Justice” Department (can you believe he is still there) is accused of helping disgraced Christopher Steele “find dirt on Trump.” Ohr’s wife, Nelly, was in on the act big time - worked fo",president
8/13/2018 9:21," While I know it’s “not presidential” to take on a lowlife like Omarosa, and while I would rather not be doing so, this is a modern day form of communication and I know the Fake News Media will be working overtime to make even Wacky Omarosa look legitimate as possible. Sorry! [Twitter for iPhone] link",president
8/13/2018 8:57," ....such wonderful and powerful things about me - a true Champion of Civil Rights - until she got fired. Omarosa had Zero credibility with the Media (they didn’t want interviews) when she worked in the White House. Now that she says bad about me, they will talk to her. Fake News! [Twitter for iPhone] link",president
8/12/2018 8:25," “Seems like the Department of Justice (and FBI) had a program to keep Donald Trump from becoming President”. @DarrellIssa @foxandfriends If this had happened to the other side, everybody involved would be",president
8/12/2018 7:34," .@GovMikeHuckabee “Your paycheck is bigger, your pension is stronger.” @foxandfriends Unemployment numbers are better than they have been in 50 years, & perhaps ever. Our country is booming like never bef",president
8/11/2018 1:28," The big story that the Fake News Media refuses to report is lowlife Christopher Steele’s many meetings with Deputy A.G. Bruce Ohr and his beautiful wife, Nelly. It was Fusion GPS that hired Steele to write the phony & discredited Dossier, paid for by Crooked Hillary & the DNC.... [Twitter for iPhone] link",president
8/8/2018 10:14," The Republicans have now won 8 out of 9 House Seats, yet if you listen to the Fake News Media you would think we are being clobbered. Why can’t they play it straight, so unfair to the Republican Party and in particular, your favorite President! [Twitter for iPhone] link",president
8/7/2018 5:46," Ohio, vote today for Troy Balderson for Congress. His opponent, controlled by Nancy Pelosi, is weak on Crime, the Border, Military, Vets, your 2nd Amendment - and will end your Tax Cuts. Troy will be a great Congressman. #MAGA [Twitter for iPhone] link",president
8/6/2018 9:25," ....a law firm, eventually Kremlin connected sources, to gather info on Donald Trump. Collusion is very real with Russia, but only with Hillary and the Democrats, and we should demand a full investigation.",president
8/6/2018 2:13," John James is a potential Republican Star who has a Senate primary election tomorrow in Michigan. If he becomes the Republican candidate, he will beat the Open Borders, weak on Crime, Democrat, Debbie Stabenow. Vote for John James and Make America Great Again! [Twitter for iPhone] link",president
8/5/2018 7:49, Too bad a large portion of the Media refuses to report the lies and corruption having to do with the Rigged Witch Hunt - but that is why we call them FAKE NEWS! [Twitter for iPhone] link,president
8/5/2018 7:35," Fake News reporting, a complete fabrication, that I am concerned about the meeting my wonderful son, Donald, had in Trump Tower. This was a meeting to get information on an opponent, totally legal and done all the time in politics - and it went nowhere. I did not know about it! [Twitter for iPhone] link",president
8/5/2018 6:38, The Fake News hates me saying that they are the Enemy of the People only because they know it’s TRUE. I am providing a great service by explaining this to the American People. They purposely cause great division & distrust. They can also cause War! They are very dangerous & sick! [Twitter for iPhone] link,president
8/3/2018 10:30, RT @seanhannity: https://t.co/RAVcGZwsiS [Twitter for iPhone] link,president
8/3/2018 10:01," Congratulations to Gregg Jarrett on his book, “THE RUSSIA HOAX, THE ILLICIT SCHEME TO CLEAR HILLARY CLINTON AND FRAME DONALD TRUMP,” going to #1 on @nytimes and Amazon. It is indeed a HOAX and WITCH HUNT, illegally started by people who have already been disgraced. Great book! [Twitter for iPhone] link",president
8/3/2018 8:06," Great photo from Ocean City, Maryland. Thank you. MAKE",president
8/3/2018 5:10, July is just the ninth month since 1970 that unemployment has fallen below 4%. Our economy has added 3.7 million jobs since I won the Election. 4.1 GDP. More than 4 million people have received a pay raise,president
8/2/2018 6:04," Wow, @foxandfriends is blowing away the competition in the morning ratings. Morning Joe is a dead show with very few people watching and sadly, Fake News CNN is also doing poorly. Too much hate and inaccurately reported stories - too predictable! [Twitter for iPhone] link",president
8/2/2018 6:04," Wow, @foxandfriends is blowing away the competition in the morning ratings. Morning Joe is a dead show with very few people watching and sadly, Fake News CNN is also doing poorly. Too much hate and inaccurately reported stories - too predictable! [Twitter for iPhone] link",president
8/2/2018 6:04," Wow, @foxandfriends is blowing away the competition in the morning ratings. Morning Joe is a dead show with very few people watching and sadly, Fake News CNN is also doing poorly. Too much hate and inaccur",president
8/2/2018 3:24," They asked my daughter Ivanka whether or not the media is the enemy of the people. She correctly said no. It is the FAKE NEWS, which is a large percentage of the media, that is the enemy of the people! [Twitter for iPhone] link",president
8/1/2018 4:04," Join me tomorrow night at 7pmE in Wilkes-Barre Township, Pennsylvania for a MAKE",president
7/31/2018 8:34," The Fake News Media is going CRAZY! They are totally unhinged and in many ways, after witnessing first hand the damage they do to so many innocent and decent people, I enjoy watching. In 7 years, when I am no longer in office, their ratings will dry up and they will be gone! [Twitter for iPhone] link",president
7/31/2018 6:00," One of the reasons we need Great Border Security is that Mexico’s murder rate in 2017 increased by 27% to 31,174 people killed, a record! The Democrats want Open Borders. I want Maximum Border Security an",president
7/31/2018 5:23," ....them richer. Their network is highly overrated, I have beaten them at every turn. They want to protect their companies outside the U.S. from being taxed, I’m for America First & the American Worker - a puppet for no one. Two nice guys with bad ideas. Make America Great Again! [Twitter for iPhone] link",president
7/29/2018 7:30," Had a very good and interesting meeting at the White House with A.G. Sulzberger, Publisher of the New York Times. Spent much time talking about the vast amounts of Fake News being put out by the media & how that Fake News has morphed into phrase, “Enemy of the People.” Sad! [Twitter for iPhone] link",president
7/29/2018 7:30," Had a very good and interesting meeting at the White House with A.G. Sulzberger, Publisher of the New York Times. Spent much time talking about the vast amounts of Fake News being put out by the media & how that Fake News has morphed into phrase, “Enemy of the People.” Sad! [Twitter for iPhone] link",president
7/29/2018 6:59," RT @realDonaldTrump: Democrats, who want Open Borders and care little about Crime, are incompetent, but they have the Fake News Media almos… [Twitter for iPhone] link",president
7/29/2018 6:52, Do you think the Fake News Media will ever report on this tweet from Michael? https://t.co/kXLCKZO5Fr [Twitter for iPhone] link,president
7/29/2018 2:09," ...dying newspaper industry. No matter how much they try to distract and cover it up, our country is making great progress under my leadership and I will never stop fighting for the American people! As an example, the failing New York Times... [Twitter for iPhone] link",president
7/27/2018 8:53," Join me in Tampa, Florida next Tuesday, July 31st at 7:00pmE for a #MAGA Rally! Tickets: https://t.co/Q2PMyTACl8 https://t.co/URjvN8Owoe [Twitter for iPhone] link",president
7/27/2018 6:38," ....,the only Collusion with Russia was with the Democrats, so now they are looking at my Tweets (along with 53 million other people) - the rigged Witch Hunt continues! How stupid and unfair to our Country....And so the Fake News doesn’t waste my time with dumb questions, NO,.... [Twitter for iPhone] link",president
7/27/2018 5:45," Democrats, who want Open Borders and care little about Crime, are incompetent, but they have the Fake News Media almost totally on their side! [Twitter for iPhone] link",president
7/27/2018 5:45," Democrats, who want Open Borders and care little about Crime, are incompetent, but they have the Fake News Media almost totally on their side! [Twitter for iPhone] link",president
7/24/2018 8:54, MAKE,president
7/24/2018 7:39," So sad and unfair that the FCC wouldn’t approve the Sinclair Broadcast merger with Tribune. This would have been a great and much needed Conservative voice for and of the People. Liberal Fake News NBC and Comcast gets approved, much bigger, but not Sinclair. Disgraceful! [Twitter for iPhone] link",president
7/23/2018 8:06," A Rocket has not been launched by North Korea in 9 months. Likewise, no Nuclear Tests. Japan is happy, all of Asia is happy. But the Fake News is saying, without ever asking me (always anonymous sources), that I am angry because it is not going fast enough. Wrong, very happy! [Twitter for iPhone] link",president
7/23/2018 7:25," When you hear the Fake News talking negatively about my meeting with President Putin, and all that I gave up, remember, I gave up NOTHING, we merely talked about future benefits for both countries. Also, we got along very well, which is a good thing, except for the Corrupt Media! [Twitter for iPhone] link",president
7/23/2018 5:13, Tom Fitton on @foxandfriends at 6:15 A.M. NOW! Judicial Watch. [Twitter for iPhone] link,president
7/22/2018 8:15, I had a GREAT meeting with Putin and the Fake News used every bit of their energy to try and disparage it. So bad for our country! [Twitter for iPhone] link,president
7/22/2018 7:56," .@PeteHegseth on @FoxNews “Source #1 was the (Fake) Dossier. Yes, the Dirty Dossier, paid for by Democrats as a hit piece against Trump, and looking for information that could discredit Candidate #1 Trum",president
7/20/2018 4:50," I got severely criticized by the Fake News Media for being too nice to President Putin. In the Old Days they would call it Diplomacy. If I was loud & vicious, I would have been criticized for being too tough. Remember when they said I was too tough with Chairman Kim? Hypocrites! [Twitter for iPhone] link",president
7/19/2018 8:24," The Summit with Russia was a great success, except with the real enemy of the people, the Fake News Media. I look forward to our second meeting so that we can start implementing some of the many things discussed, including stopping terrorism, security for Israel, nuclear........ [Twitter for iPhone] link",president
7/19/2018 6:13, “Trump recognized Russian Meddling MANY TIMES.” Thank you to @foxandfriends and @FoxNews for actually showing the clips. The Fake News wants no part of that narrative! Too bad they don’t want to focus on all of the ECONOMIC and JOBS records being set. [Twitter for iPhone] link,president
7/19/2018 6:13, “Trump recognized Russian Meddling MANY TIMES.” Thank you to @foxandfriends and @FoxNews for actually showing the clips. The Fake News wants no part of that narrative! Too bad they don’t want to focus on,president
7/19/2018 5:59," The Fake News Media wants so badly to see a major confrontation with Russia, even a confrontation that could lead to war. They are pushing so recklessly hard and hate the fact that I’ll probably have a good relationship with Putin. We are doing MUCH better than any other country! [Twitter for iPhone] link",president
7/19/2018 5:37," The Fake News Media is going Crazy! They make up stories without any backup, sources or proof. Many of the stories written about me, and the good people surrounding me, are total fiction. Problem is, when you complain you just give them more publicity. But I’ll complain anyway! [Twitter for iPhone] link",president
7/19/2018 1:14, Will the Dems and Fake News ever learn? This is classic! https://t.co/kSX3ROI4QG [Twitter for iPhone] link,president
7/18/2018 6:03, “A lot of Democrats wished they voted for the Tax Cuts because the economy is booming - we could have 4% growth now and the Fed said yesterday that unemployment could drop again.” @foxandfriends @kilmead,president
7/17/2018 9:22," While I had a great meeting with NATO, raising vast amounts of money, I had an even better meeting with Vladimir Putin of Russia. Sadly, it is not being reported that way - the Fake News is going Crazy! [Twitter for iPhone] link",president
7/17/2018 7:21," The meeting between President Putin and myself was a great success, except in the Fake News Media! [Twitter for iPhone] link",president
7/16/2018 5:53, Will be interviewed on @seanhannity tonight at 9pmE and @TuckerCarlson tomorrow night at 8pmE. Enjoy! [Twitter for iPhone] link,president
7/15/2018 11:11," There hasn’t been a missile or rocket fired in 9 months in North Korea, there have been no nuclear tests and we got back our hostages. Who knows how it will all turn out in the end, but why isn’t the Fake News talking about these wonderful facts? Because it is FAKE NEWS! [Twitter for iPhone] link",president
7/14/2018 6:24," So funny! I just checked out Fake News CNN, for the first time in a long time (they are dying in the ratings), to see if they covered my takedown yesterday of Jim Acosta (actually a nice guy). They didn’t! But they did say I already lost in my meeting with Putin. Fake News...... [Twitter for iPhone] link",president
7/14/2018 6:24," So funny! I just checked out Fake News CNN, for the first time in a long time (they are dying in the ratings), to see if they covered my takedown yesterday of Jim Acosta (actually a nice guy). They didn’t! But they did say I already lost in my meeting with Putin. Fake News...... [Twitter fo",president
7/14/2018 1:17," These Russian individuals did their work during the Obama years. Why didn’t Obama do something about it? Because he thought Crooked Hillary Clinton would win, that’s why. Had nothing to do with the Trump Administration, but Fake News doesn’t want to report the truth, as usual! [Twitter for iPhone] link",president
7/12/2018 12:55," As I head out to a very important NATO meeting, I see that FBI Lover/Agent Lisa Page is dodging a Subpoena & is refusing to show up and testify. What can she possibly say about her statements and lies. S",president
7/9/2018 12:04, The failing NY Times Fake News story today about breast feeding must be called out. The U.S. strongly supports breast feeding but we don’t believe women should be denied access to formula. Many women need this option because of malnutrition and poverty. [Twitter for iPhone] link,president
7/7/2018 8:21," Twitter is getting rid of fake accounts at a record pace. Will that include the Failing New York Times and propaganda machine for Amazon, the Washington Post, who constantly quote anonymous sources that, in my opinion, don’t exist - They will both be out of business in 7 years! [Twitter for iPhone] link",president
7/5/2018 7:11," It was my great honor to join proud, hardworking American Patriots in Montana tonight. I love you - thank you! #MAGA https://t.co/475ct7hW3D [Twitter for iPhone] link",president
7/3/2018 6:16," Many good conversations with North Korea-it is going well! In the meantime, no Rocket Launches or Nuclear Testing in 8 months. All of Asia is thrilled. Only the Opposition Party, which includes the Fake News, is complaining. If not for me, we would now be at War with North Korea! [Twitter for iPhone] link",president
7/3/2018 6:13," After having written many best selling books, and somewhat priding myself on my ability to write, it should be noted that the Fake News constantly likes to pore over my tweets looking for a mistake. I capitalize certain words only for emphasis, not b/c they should be capitalized! [Twitter for iPhone] link",president
7/3/2018 4:19," After having written many best selling books, and somewhat priding myself on my ability to write, it should be noted that the Fake News constantly likes to pour over my tweets looking for a mistake. I capitalize certain words only for emphasis, not b/c they should be capitalized! [Twitter for iPhone] link",president
7/1/2018 7:11," The Liberal Left, also known as the Democrats, want to get rid of ICE, who do a fantastic job, and want Open Borders. Crime would be rampant and uncontrollable! Make America Great Again [Twitter for iPhone] link",president
7/1/2018 7:00, I will be interviewed by @MariaBartiromo at 10:00 A.M. on @FoxNews [Twitter for iPhone] link,president
6/30/2018 2:31, I will be interviewed by @MariaBartiromo on Sunday on @FoxNews at 10:00 A. M. Enjoy! [Twitter for iPhone] link,president
6/29/2018 6:21," RT @FoxBusiness: .@IvankaTrump: ""I think one of the tremendous opportunities that were seeing because the economy is so strong is that peop… [Twitter for iPhone] link",president
6/28/2018 6:38," Just watched @SharkGregNorman on @foxandfriends. Said “President is doing a great job. All over the world, people want to come back to the U.S.” Thank you Greg, and you’re looking and doing great! [Twitt",president
6/28/2018 6:32," Amy Kremer, Women for Trump, was so great on @foxandfriends. Brave and very smart, thank you Amy! @AmyKremer [Twitter for iPhone] link",president
6/27/2018 10:03," Thank you North Dakota. Together, we are MAKING",president
6/27/2018 6:18," Congratulations to Maxine Waters, whose crazy rants have made her, together with Nancy Pelosi, the unhinged FACE of the Democrat Party. Together, they will Make America Weak Again! But have no fear, America is now stronger than ever before, and I’m not going anywhere! [Twitter for iPhone] link",president
6/25/2018 12:11," Congresswoman Maxine Waters, an extraordinarily low IQ person, has become, together with Nancy Pelosi, the Face of the Democrat Party. She has just called for harm to supporters, of which there are many, of the Make America Great Again movement. Be careful what you wish for Max! [Twitter for iPhone] link",president
6/25/2018 7:36," Such a difference in the media coverage of the same immigration policies between the Obama Administration and ours. Actually, we have done a far better job in that our facilities are cleaner and better run than were the facilities under Obama. Fake News is working overtime! [Twitter for iPhone] link",president
6/25/2018 6:44, Just landed in South Carolina - will be at the McMaster rally shortly! #MAGA [Twitter for iPhone] link,president
6/25/2018 4:28," Surprised that Harley-Davidson, of all companies, would be the first to wave the White Flag. I fought hard for them and ultimately they will not pay tariffs selling into the E.U., which has hurt us badly on trade, down $151 Billion. Taxes just a Harley excuse - be patient! #MAGA [Twitter for iPhone] link",president
6/24/2018 10:08," ....Our Immigration policy, laughed at all over the world, is very unfair to all of those people who have gone through the system legally and are waiting on line for years! Immigration must be based on merit - we need people who will help to Make America Great Again! [Twitter for iPhone] link",president
6/23/2018 9:00," ...everyone how much he likes me, but he will only vote with Nancy Pelosi. Keith is strong on borders and tough on crime — and loves cutting taxes! #MAGA [Twitter for iPhone] link",president
6/23/2018 7:52," Drudge Report “OBAMA KEPT THEM IN CAGES, WRAPPED THEM IN FOIL” We do a much better job while at the same time maintaining a MUCH stronger Border! Mainstream Fake Media hates this story. [Twitter for iPhone] link",president
6/23/2018 7:42, “Disability applications plunge as economy strengthens” Failing New York Times [Twitter for iPhone] link,president
6/23/2018 6:33," .@FoxNews Poll numbers plummet on the Democrat inspired and paid for Russian Witch Hunt. With all of the bias, lying and hate by the investigators, people want the investigators investigated. Much more w",president
6/23/2018 3:25, Thank you @NVGOP! #MAGA https://t.co/OGTR2j6PGG [Twitter for iPhone] link,president
6/22/2018 6:46, Congresswoman Martha Roby of Alabama has been a consistent and reliable vote for our Make America Great Again Agenda. She is in a Republican Primary run-off against a recent Nancy Pelosi voting Democrat. I fully endorse Martha for Alabama 2nd Congressional District! [Twitter for iPhone] link,president
6/21/2018 8:52," Henry McMaster has done a great job as Governor of South Carolina. The state is BOOMING, with jobs and new industry setting records. He is tough on Crime and Strong on Borders, Healthcare, the Military and our great Vets. Henry has my full and complete Endrosement! #MAGA [Twitter for iPhone] link",president
6/21/2018 7:47," Henry McMaster has done a great job as Governor of South Carolina. The State is BOOMING, with jobs and new industry setting records. He is tough on Crime and strong on Borders, Health Care, the Mititary and our great Vets. Henry has my full and complete Endorsement! #MAGA [Twitter for iPhone] link",president
6/21/2018 4:51," “I REALLY DON’T CARE, DO U?” written on the back of Melania’s jacket, refers to the Fake News Media. Melania has learned how dishonest they are, and she truly no longer cares! [Twitter for iPhone] link",president
6/20/2018 10:00, More records! #MAGA https://t.co/2CP5eq40Fy [Twitter for iPhone] link,president
6/20/2018 9:00," “FBI texts have revealed anti-Trump Bias.” @FoxNews Big News, but the Fake News doesn’t want to cover. Total corruption - the Witch Hunt has turned out to be a scam! At some point soon the Mainstream Media will have to cover correctly, too big a story! [Twitter for iPhone] link",president
6/20/2018 9:00," “FBI texts have revealed anti-Trump Bias.” @FoxNews Big News, but the Fake News doesn’t want to cover. Total corruption - the Witch Hunt has turned out to be a scam! At some point soon the Mainstream Med",president
6/20/2018 7:25," The Fake News is not mentioning the safety and security of our Country when talking about illegal immigration. Our immigration laws are the weakest and worst anywhere in the world, and the Dems will do anything not to change them & to obstruct-want open borders which means crime! [Twitter for iPhone] link",president
6/19/2018 10:22," Join me tomorrow in Duluth, Minnesota for a #MAGA Rally! Tickets: https://t.co/mhhJB8WQlF https://t.co/gP59o1RDqW [Twitter for iPhone] link",president
6/18/2018 9:57," If President Obama (who got nowhere with North Korea and would have had to go to war with many millions of people being killed) had gotten along with North Korea and made the initial steps toward a deal that I have, the Fake News would have named him a national hero! [Twitter for iPhone] link",president
6/17/2018 8:26, Washington Post employees want to go on strike because Bezos isn’t paying them enough. I think a really long strike would be a great idea. Employees would get more money and we would get rid of Fake News for an extended period of time! Is @WaPo a registered lobbyist? [Twitter for iPhone] link,president
6/17/2018 7:40," Funny how the Fake News, in a coordinated effort with each other, likes to say I gave sooo much to North Korea because I “met.” That’s because that’s all they have to disparage! We got so much for peace in the world, & more is being added in finals. Even got our hostages/remains! [Twitter for iPhone] link",president
6/17/2018 7:25," Why was the FBI giving so much information to the Fake News Media. They are not supposed to be doing that, and knowing the enemy of the people Fake News, they put their own spin on it - truth doesn’t matter to them! [Twitter for iPhone] link",president
6/17/2018 6:58, Please clear up the Fake News! https://t.co/3VbIKbmKwP [Twitter for iPhone] link,president
6/15/2018 12:49," I’ve had to beat 17 very talented people including the Bush Dynasty, then I had to beat the Clinton Dynasty, and now I have to beat a phony Witch Hunt and all of the dishonest people covered in the IG Report...and never forget the Fake News Media. It never ends! [Twitter for iPhone] link",president
6/15/2018 6:56," RT @foxandfriends: IG REPORT BOMBSHELL: Anti-Trump FBI agent Peter Strzok texted his lover Lisa Page ""we'll stop"" Trump from becoming presi… [Twitter for iPhone] link",president
6/15/2018 6:56, RT @foxandfriends: DOJ IG report finds that an FBI lawyer told a bureau employee “Viva le resistance” after President Trump was elected htt… [Twitter for iPhone] link,president
6/15/2018 6:55, RT @foxandfriends: “This is one of the most damning rebukes of the FBI that I think we’ve ever seen.” -@jasoninthehouse https://t.co/9DoTim… [Twitter for iPhone] link,president
6/15/2018 6:55, RT @foxandfriends: .@jasoninthehouse: The DOJ IG report is 562 pages of nothing but bias and animus https://t.co/7IeXfmvo1M [Twitter for iPhone] link,president
6/15/2018 6:55, RT @foxandfriends: .@jasoninthehouse: Anything Mueller is doing with his investigation is tainted by the anti-Trump FBI agents https://t.co… [Twitter for iPhone] link,president
